{
  "$schema": "https://json-schema.org/draft/2020-12/schema",
  "title": "EpistemicToolbox",
  "type": "array",
  "description": "A collection of epistemic tools used to represent and reason about reality.",
  "items": {
    "type": "object",
    "required": ["name", "description"],
    "properties": {
      "name": {
        "type": "string",
        "description": "Canonical name of the epistemic tool.",
        "minLength": 1
      },
      "description": {
        "type": "string",
        "description": "Concise explanation of the tool and its epistemic function.",
        "minLength": 1
      },
      "url": {
        "type": "string",
        "description": "Reference URL for further documentation or usage context.",
        "format": "uri"
      },
      "svg-icon": {
        "type": "string",
        "description": "SVG markup or path reference representing the tool icon."
      },
      "tags": {
        "type": "array",
        "description": "Semantic or functional tags for classification and retrieval.",
        "items": {
          "type": "string",
          "minLength": 1
        },
        "uniqueItems": true
      }
    },
    "additionalProperties": false
  }
}