[
    {
        "name": "Data Visualization",
        "description": "A visual representation technique used to transform structured or unstructured data into perceptually interpretable forms, enabling efficient exploration of patterns, trends, and the space of possible affirmations about the underlying reality.",
        "url": "https://www.bremontix.xyz/toolbox/tool/visualization/index.html",
        "svg-icon": "icon-data-visualization",
        "tags": [
            "category",
            "visual",
            "representation",
            "exploration",
            "pattern-detection",
            "affirmation-space"
        ]
    },
    {
        "name": "Standard Deviation",
        "description": "A statistical measure of dispersion that quantifies the extent of variability or spread in a dataset relative to its mean, enabling affirmations about consistency, volatility, and distributional structure.",
        "url": "https://www.bremontix.xyz/toolbox/tool/std.html",
        "svg-icon": "icon-standard-deviation",
        "tags": [
            "category",
            "statistical",
            "dispersion",
            "variability",
            "distribution",
            "quantitative"
        ]
    },
    {
        "name": "Dimensionality Reduction",
        "description": "A technique that identifies the directions (principal components) along which the variation in the data is maximized, facilitating recognition of latent structures and core dynamics in complex datasets.",
        "url": "https://www.bremontix.xyz/toolbox/tool/pca.html",
        "svg-icon": "icon-pca",
        "tags": [
            "category",
            "statistical",
            "dimensionality-reduction",
            "latent-structure",
            "pattern-detection"
        ]
    },
    {
        "name": "Regression Analysis",
        "description": "A method to model and quantify the relationship between variables, allowing affirmations about causality, predictive trends, and dependency structures in data.",
        "url": "https://www.bremontix.xyz/toolbox/tool/regression.html",
        "svg-icon": "icon-regression",
        "tags": [
            "category",
            "statistical",
            "causal-inference",
            "prediction",
            "trend-analysis"
        ]
    },
    {
        "name": "Clustering",
        "description": "A technique to partition data into groups based on similarity, supporting the identification of emergent categories, coherent patterns, and structural organization in complex reality.",
        "url": "https://www.bremontix.xyz/toolbox/tool/clustering.html",
        "svg-icon": "icon-clustering",
        "tags": [
            "category",
            "unsupervised",
            "pattern-detection",
            "classification",
            "structure-exploration"
        ]
    },
    {
        "name": "Network Analysis",
        "description": "A framework for mapping and quantifying relationships and interactions between entities, enabling affirmations about connectivity, influence, and systemic structure.",
        "url": "https://www.bremontix.xyz/toolbox/tool/network.html",
        "svg-icon": "icon-network",
        "tags": [
            "category",
            "graph",
            "connectivity",
            "systemic-structure",
            "relation-mapping"
        ]
    },
    {
        "name": "Bayesian Inference",
        "description": "A probabilistic reasoning method that updates beliefs about reality in light of evidence, facilitating affirmations under uncertainty and modeling conditional dependencies.",
        "url": "https://www.bremontix.xyz/toolbox/tool/bayesian.html",
        "svg-icon": "icon-bayesian",
        "tags": [
            "category",
            "probabilistic",
            "uncertainty",
            "belief-updating",
            "conditional-structure"
        ]
    },
    {
        "name": "Time Series Analysis",
        "description": "A set of methods to analyze temporal data, detect trends, seasonality, and anomalies, and generate affirmations about dynamic processes evolving over time.",
        "url": "https://www.bremontix.xyz/toolbox/tool/timeseries.html",
        "svg-icon": "icon-timeseries",
        "tags": [
            "category",
            "temporal",
            "trend-detection",
            "dynamics",
            "anomaly-detection"
        ]
    },
    {
        "name": "Monte Carlo Simulation",
        "description": "A computational method to estimate the behavior of complex systems under uncertainty by random sampling, enabling affirmations about distributions, risks, and expected outcomes.",
        "url": "https://www.bremontix.xyz/toolbox/tool/montecarlo.html",
        "svg-icon": "icon-montecarlo",
        "tags": [
            "category",
            "stochastic",
            "simulation",
            "risk-analysis",
            "probabilistic-modeling"
        ]
    },
    {
        "name": "Hypothesis Testing",
        "description": "A statistical procedure to assess assumptions about reality, facilitating affirmations about the presence of effects, differences, or associations in data.",
        "url": "https://www.bremontix.xyz/toolbox/tool/hypothesis.html",
        "svg-icon": "icon-hypothesis",
        "tags": [
            "category",
            "statistical",
            "significance",
            "affirmation-testing",
            "causal-inference"
        ]
    },
    {
        "name": "Burstiness Index",
        "description": "A statistical measure that quantifies the degree of temporal clustering in a sequence of events. It facilitates reasoning about variability and regularity in event arrivals, supporting affirmations about patterns, dependencies, and deviations from expected randomness.",
        "url": "https://www.bremontix.xyz/toolbox/burstiness.html",
        "svg-icon": "icon-hypothesis",
        "tags": [
            "tool",
            "statistic",
            "temporal-patterns",
            "affirmation-testing",
            "causal-inference"
        ]
    },
    {
        "name": "Law of Large Numbers",
        "description": "A fundamental theorem in probability stating that as the number of trials increases, the sample average converges to the expected value. It supports reasoning about statistical stability, convergence, and the reliability of empirical estimates.",
        "url": "https://www.bremontix.xyz/toolbox/law-of-large-numbers.html",
        "svg-icon": "icon-hypothesis",
        "tags": [
            "theory",
            "statistics",
            "probability",
            "convergence",
            "estimation"
        ]
    }
]